[
  {
    "Color": "keine",
    "DecimalValue": "not_allowed",
    "UnitValue": "not_allowed",
    "Multiplier": "not_allowed",
    "Tolerance": "20"
  },
  {
    "Color": "silber",
    "DecimalValue": "not_allowed",
    "UnitValue": "not_allowed",
    "Multiplier": "-2",
    "Tolerance": "10"
  },
  {
    "Color": "gold",
    "DecimalValue": "not_allowed",
    "UnitValue": "not_allowed",
    "Multiplier": "-1",
    "Tolerance": "5"
  },
  {
    "Color": "schwarz",
    "DecimalValue": "not_allowed",
    "UnitValue": "0",
    "Multiplier": "-0",
    "Tolerance": "not_allowed"
  },
  {
    "Color": "braun",
    "DecimalValue": "1",
    "UnitValue": "1",
    "Multiplier": "1",
    "Tolerance": "1"
  },
  {
    "Color": "rot",
    "DecimalValue": "2",
    "UnitValue": "2",
    "Multiplier": "2",
    "Tolerance": "2"
  },
  {
    "Color": "orange",
    "DecimalValue": "3",
    "UnitValue": "3",
    "Multiplier": "3",
    "Tolerance": "not_allowed"
  },
  {
    "Color": "gelb",
    "DecimalValue": "4",
    "UnitValue": "4",
    "Multiplier": "4",
    "Tolerance": "not_allowed"
  },
  {
    "Color": "grün",
    "DecimalValue": "5",
    "UnitValue": "5",
    "Multiplier": "5",
    "Tolerance": "0,5"
  },
  {
    "Color": "blau",
    "DecimalValue": "6",
    "UnitValue": "6",
    "Multiplier": "6",
    "Tolerance": "0,25"
  },
  {
    "Color": "violett",
    "DecimalValue": "7",
    "UnitValue": "7",
    "Multiplier": "7",
    "Tolerance": "0,1"
  },
  {
    "Color": "grau",
    "DecimalValue": "8",
    "UnitValue": "8",
    "Multiplier": "8",
    "Tolerance": "0,05"
  },
  {
    "Color": "weiß",
    "DecimalValue": "9",
    "UnitValue": "9",
    "Multiplier": "9",
    "Tolerance": "not_allowed"
  }
]